File,Author,Email,Affiliation
ab-104.xml,Douwe Zeldenrust,douwe.zeldenrust@meertens.knaw.nl,"Meertens Instituut (Royal Netherlands Academy of Arts and Sciences), Netherlands, The"
ab-104.xml,Marc Van Oostendorp,m.van.oostendorp@hum.leidenuniv.nl ,"Leiden University, Netherlands, The"
ab-106.xml,Md. Anwarul Islam,anwar81du@gmail.com,Univeristy of Dhaka
ab-107.xml,Willard McCarty,willard.mccarty@kcl.ac.uk,"King's College London, United Kingdom"
ab-108.xml,Desmond Schmidt,desmond.allan.schmidt@gmail.com,University of Queensland
ab-110.xml,Pavel Thomas Cenkl,pcenkl@sterlingcollege.edu,"Sterling College, United States of America"
